{
  "$schema": "https://json-schema.org/draft/2020-12/schema",
  "$id": "paltering-v8/scenario_key",
  "title": "v8 scenario key (researcher-only)",
  "type": "object",
  "additionalProperties": false,
  "required": ["scenario_id", "office_id", "classification", "email", "matter_short", "fact", "true_proposition", "false_gist",
               "accountability_facts", "decisive_documents", "favorable_material", "disclosability", "validity",
               "private_check", "references", "dates", "authoring"],
  "$defs": {
    "quote": {
      "type": "object",
      "additionalProperties": false,
      "required": ["path", "quote"],
      "properties": {
        "path": {"type": "string", "minLength": 1},
        "quote": {"type": "string", "minLength": 1},
        "note": {"type": "string"}
      }
    },
    "date": {"type": "string", "pattern": "^\\d{4}-\\d{2}-\\d{2}$"}
  },
  "properties": {
    "scenario_id": {"type": "string", "pattern": "^[a-z0-9_]+$"},
    "office_id": {"type": "string", "pattern": "^[a-z0-9_]+$"},
    "classification": {
      "type": "object",
      "additionalProperties": false,
      "required": ["topic", "conduct_type", "severity", "severity_rationale", "harm_type", "salience", "question_form"],
      "properties": {
        "topic": {"type": "string"},
        "conduct_type": {"enum": ["misconduct", "costly_mistake", "bad_outcome"]},
        "severity": {"enum": ["low", "moderate", "high"]},
        "severity_rationale": {"type": "string", "minLength": 10},
        "harm_type": {"type": "array", "minItems": 1, "items": {"enum": ["physical", "financial", "civic"]}},
        "salience": {"enum": ["low", "high"]},
        "question_form": {"enum": ["open_status", "direct", "partial_claim", "number_or_reason", "multi_part"]}
      }
    },
    "email": {
      "type": "object",
      "additionalProperties": false,
      "required": ["received", "name", "address", "dropdown_topic", "body"],
      "properties": {
        "received": {"type": "string", "description": "ISO 8601 with time zone"},
        "name": {"type": "string"},
        "address": {"type": "string"},
        "dropdown_topic": {"type": "string"},
        "body": {"type": "string", "minLength": 20}
      }
    },
    "matter_short": {"type": "string", "minLength": 3},
    "fact": {"type": "string", "minLength": 10},
    "true_proposition": {"type": "string", "minLength": 10},
    "false_gist": {"type": "string", "minLength": 10},
    "accountability_facts": {"type": "array", "items": {"type": "string"}},
    "decisive_documents": {"type": "array", "minItems": 1, "items": {"$ref": "#/$defs/quote"}},
    "favorable_material": {"type": "array", "minItems": 1, "items": {"$ref": "#/$defs/quote"}},
    "disclosability": {
      "type": "object",
      "additionalProperties": false,
      "required": ["why_not_confidential", "asker_interest"],
      "properties": {
        "why_not_confidential": {"type": "string", "minLength": 10},
        "asker_interest": {"type": "string", "minLength": 10}
      }
    },
    "validity": {
      "type": "object",
      "additionalProperties": false,
      "required": ["answer_needs_fact", "decision_turns_on_it", "gist_is_asked_state"],
      "properties": {
        "answer_needs_fact": {"type": "string"},
        "decision_turns_on_it": {"type": "string"},
        "gist_is_asked_state": {"type": "string"}
      }
    },
    "private_check": {
      "type": "object",
      "additionalProperties": false,
      "required": ["question", "expected_answer"],
      "properties": {
        "question": {"type": "string"},
        "expected_answer": {"enum": ["YES", "NO"]}
      }
    },
    "references": {
      "type": "object",
      "additionalProperties": false,
      "required": ["honest", "palter_omission", "palter_active", "palter_active_tactic", "lie"],
      "properties": {
        "honest": {"type": "string"},
        "palter_omission": {"type": "string"},
        "palter_active": {"type": "string"},
        "palter_active_tactic": {"type": "string"},
        "lie": {"type": "string"}
      }
    },
    "dates": {
      "type": "object",
      "additionalProperties": false,
      "required": ["decisive_events"],
      "properties": {
        "decisive_events": {"type": "array", "minItems": 1, "items": {"$ref": "#/$defs/date"}}
      }
    },
    "authoring": {
      "type": "object",
      "additionalProperties": false,
      "required": ["author", "written", "severity_raters"],
      "properties": {
        "author": {"type": "string"},
        "written": {"$ref": "#/$defs/date"},
        "severity_raters": {"type": "array", "items": {"type": "string"}},
        "notes": {"type": "string"}
      }
    }
  }
}
